but you know what you could use this as?,patricia fathertoy.cha,971,know,think,know,know,interrogative,interrogative,2,6.096,yes,patricia,father,"FATHER: \t alright, what's this?",FATHER: \t do you know what this is?,CHILD: \t what?,"FATHER: \t we... your... your Emma and I don't drink any of this stuff, so you don't know.",FATHER: \t do you know what coffee...,FATHER: \t do you have to go to the bathroom?,CHILD: \t no.,FATHER: \t no.,FATHER: \t um it's a coffee.,FATHER: \t coffee comes in here.,FATHER: \t but you know what you could use this as?,CHILD: \t what?,FATHER: \t a what?,666,know-interrogative-interrogative
"hey, you know what would happen if I weren't holding on to this chair?",charlie dinner.cha,4176,know,think,know,know,interrogative,interrogative,2,6.1,no,charlie,dinner,"CHILD: \t Ma, please get me out of here.",MOTHER: \t first I have to clean you off.,MOTHER: \t would you wait here?,FATHER: \t hey!,FATHER: \t what's up?,CHILD: \t I don't want any.,FATHER: \t you don't want any.,FATHER: \t I think you have enough on your shirt... to last you through a long cold winter.,MOTHER: \t let's see your face.,CHILD: \t [noise],"FATHER: \t hey, you know what would happen if I weren't holding on to this chair?",CHILD: \t what?,FATHER: \t and you were climbing up on it like that?,666,know-interrogative-interrogative
and you know what she does?,guy mothertoy.cha,2706,know,think,know,know,interrogative,interrogative,2,6.17,yes,guy,mother,MOTHER: \t the cat goes up the tree.,MOTHER: \t and you know what happens when cats go up trees?,MOTHER: \t it's hard to find them.,MOTHER: \t but the policeman grabs the kitty.,MOTHER: \t uh oh.,MOTHER: \t they fall down.,MOTHER: \t mhm.,MOTHER: \t you know what I discovered?,CHILD: \t what?,MOTHER: \t this lady... is a nurse like nurse Mathilda.,MOTHER: \t and you know what she does?,MOTHER: \t she puts on her nursing costume.,MOTHER: \t see it?,666,know-interrogative-interrogative
you know what she brought for em?,laurel mothertoy.cha,1591,know,think,know,know,interrogative,interrogative,2,6.171,yes,laurel,mother,MOTHER: \t poor policeman hurt himself.,MOTHER: \t he has a little cane he's walking on.,MOTHER: \t and the little boy got into the carriage.,MOTHER: \t and the cat is walking behind him.,MOTHER: \t well.,MOTHER: \t I guess the little girl's gonna bring em all home.,MOTHER: \t let's see.,MOTHER: \t do you think she's gonna bring em into her house?,CHILD: \t no.,MOTHER: \t oh.,MOTHER: \t you know what she brought for em?,CHILD: \t [noise],MOTHER: \t what does she have for them?,666,know-interrogative-interrogative
you know how it works?,isadora mothertoy.cha,3231,know,think,know,know,interrogative,interrogative,2,6.177,yes,isadora,mother,INVESTIGATOR: \t well.,INVESTIGATOR: \t you can do that.,MOTHER: \t you wanna do that for a minute?,INVESTIGATOR: \t hi.,INVESTIGATOR: \t I brought you a present.,INVESTIGATOR: \t you know what that is ?,MOTHER: \t oh look what you have.,MOTHER: \t what do you say?,MOTHER: \t what do you say?,CHILD: \t thank you.,MOTHER: \t you know how it works?,INVESTIGATOR: \t oh.,INVESTIGATOR: \t you do I think.,666,know-interrogative-interrogative
"okay, do you know where to put that?",frank mothertoy.cha,1817,know,think,know,know,interrogative,interrogative,2,6.193,no,frank,mother,MOTHER: \t is there another one?,MOTHER: \t another color?,CHILD: \t ah... there's only three.,MOTHER: \t how bout that yellow one?,CHILD: \t this one?,MOTHER: \t yeah.,MOTHER: \t but there should be another yellow one.,MOTHER: \t oh there it is underneath there.,MOTHER: \t okay.,CHILD: \t where?,"MOTHER: \t okay, do you know where to put that?",CHILD: \t yeah.,CHILD: \t like this?,666,know-interrogative-interrogative
do you know what this is? ,andy mothertoy.cha,1186,know,think,know,know,interrogative,interrogative,2,6.237,no,andy,mother,MOTHER: \t okay can you... ,CHILD: \t where's my man ? ,MOTHER: \t can you put...,MOTHER: \t on it...,MOTHER: \t that's the woman. ,CHILD: \t here is my man. ,CHILD: \t hey where... ,"MOTHER: \t okay, can you put a wheel back here? ",MOTHER: \t Andy can you... can you get this one in? ,CHILD: \t [noise] bee. ,MOTHER: \t do you know what this is? ,MOTHER: \t well it goes back here. ,CHILD: \t [noise],666,know-interrogative-interrogative
do you know what that is?,patricia mothertoy.cha,1415,know,think,know,know,interrogative,interrogative,2,6.259,no,patricia,mother,MOTHER: \t that's what we have?,CHILD: \t yeah.,MOTHER: \t is ours a little one like this?,CHILD: \t yes.,MOTHER: \t wow.,MOTHER: \t this one's old.,MOTHER: \t huh.,MOTHER: \t what else?,CHILD: \t um.,MOTHER: \t what else should we buy?,MOTHER: \t do you know what that is?,CHILD: \t um.,CHILD: \t look at this.,666,know-interrogative-interrogative
do you know what that is?,laurel fathertoy.cha,2125,know,think,know,know,interrogative,interrogative,2,6.267,no,laurel,father,CHILD: \t hunhunh.,FATHER: \t I don't see one.,FATHER: \t well.,FATHER: \t I guess it didn't.,FATHER: \t you wanna put that on?,CHILD: \t what?,FATHER: \t ya want...,CHILD: \t [noise],FATHER: \t put the steering wheel back on.,FATHER: \t what's that?,FATHER: \t do you know what that is?,CHILD: \t [noise],FATHER: \t what is it?,666,know-interrogative-interrogative
do you know what she's wearing?,nanette mothertoy.cha,1924,know,think,know,know,interrogative,interrogative,2,6.276,yes,nanette,mother,MOTHER: \t what's he doing?,CHILD: \t what... what... what Puddy doing?,MOTHER: \t what is he doing?,CHILD: \t what's Puddy doing?,MOTHER: \t there's Puddy right there.,MOTHER: \t but look at the little boy.,MOTHER: \t the little boy is in the carriage.,MOTHER: \t I don't know.,MOTHER: \t this is a... funny mixed up story.,"MOTHER: \t oh, look it, they're pretending now to have a tea party.",MOTHER: \t do you know what she's wearing?,CHILD: \t a hat.,MOTHER: \t do you know what kind of hat that is?,666,know-interrogative-interrogative