matched_term,file_name,match_line_number,know_option,think_option,verb,force,comp,subj,unique_id,child,interaction,context_pre_1,context_pre_2,context_pre_3,context_pre_4,context_pre_5,context_pre_6,context_pre_7,context_pre_8,context_pre_9,context_pre_10,matched_line,context_post_1,context_post_2,Sample_Set
"I know you're <finished , > [>] Rachi .",john_dinner.cha,2188,know,think,know,declarative,declarative,1,1.003,john,dinner,*MOT:	Jimmy Carter would win.,*FAT:	I just wanted to make sure last time +/.,*MOT:	that .. what?,*SIS:	I going in there.,*MOT:	I don't think so.,*MOT:	because they're working in there.,*MOT:	and they don't want you to come there now.,*MOT:	after when they're finished you can come there.,*FAT:	they will be happy to have you +/.,*SIS:	and me finished.,"*MOT:	I know you're finished,   Rachi.",*SIS:	please .,*MOT:	how about something else?,8138
I know it's not a big favor [=! laughing] .,victor_dinner.cha,3411,know,think,know,declarative,declarative,1,1.016,victor,dinner,*MOT: [imitates noise so cold]?,*MOT:	no thank_you.,*FAT:	&mm: boy.,*MOT: [snickers].,*FAT: [snickers and grunts]6. no thanks.,*MOT:	goes with the corn on 3. your chin.,"*FAT:	orange and yellow, it's very . xxx sunny ya know.",*CHI:	no?,*MOT:	no thanks I'm debating whether to tell you guys you can come to the,*FAT: [laughing don't do me any favors xxx].,*MOT:	I know it's not a big favor [laughing].,*MOT:	that's why I'm debating.,*FAT:	[laughs].,8138
"oh yeah , I know that's a_lot_of good stuff in there xxx .",katie_dinner.cha,2081,know,think,know,declarative,declarative,1,1.013,katie,dinner,*MOT:	we're not gonna eat here so you can have a xxx .,*AUN:	xxx  left over night is the night you guys go out [laughs].,*FAT:	gonna finish your muffin?,"*AUN:	no, I'll xxx  .",*MOT:	give  her time.,*MOT:	give her time.,*AUN:	I like leftovers.,"*MOT:	well, there's  there's xxx and there's macaroni .",*CHI:	&mm .,*CHI:	&mm .,"*AUN:	oh yeah, I know that's a_lot_of good stuff in there xxx.","*AUN:	Katie, it's left over night.",*CHI:	who?,8138
I know I want some milk .,isadora_fathertoy.cha,364,know,think,know,declarative,declarative,1,1.019,isadora,father,*FAT:	can you find a good cereal in your store for me?,*CHI:	mhm.,*FAT:	which kind of good cereal is that?,*CHI:	&um there  there's drinks here too.,*FAT:	there're drinks too?,*CHI:	you could have hotdogs.,*FAT:	not for breakfast.,*CHI:	mhm.,*FAT:	well.,*FAT:	look.,*FAT:	I know I want some milk.,*FAT:	can I have one of these?,*CHI:	yeah.,8138
I know he's awfully tired .,ursula_mothertoy.cha,2065,know,think,know,declarative,declarative,1,1.022,ursula,mother,"*MOT:	well the branch wasn't strong enough to hold him, so he's gonna",*CHI:	xxx.,"*MOT:	thud, right on the ground.",*MOT:	well . they're all kinda  battered and bruised and,*MOT:	there he .,*MOT:	look at him.,*MOT:	he's walking along behind just as . like nothing happened.,*MOT:	proud as can be .,*CHI:	is  is he a baby?,"*MOT:	no, I think he's kinda  tired out so they put him in",*MOT:	I know he's awfully tired.,*MOT:	look at him.,*MOT:	he ca  he's sitting down resting.,8138
I know these go here .,david_mothertoy.cha,3541,know,think,know,declarative,declarative,1,1.012,david,mother,*MOT:	xxx.,*CHI:	take that thing out.,*MOT:	&uh oh.,*MOT:	&uh oh.,*CHI:	what happened?,*MOT:	&uh oh.,*MOT:	xxx.,*MOT:	the little bit that I did fell out.,*CHI:	which fell out?,*MOT:	the little nuts that I put back in.,*MOT:	I know these go here.,*MOT:	that's about the only thing I know.,*MOT:	okay.,8138
I know I hate those things too artificial corn holders .,victor_dinner.cha,1846,know,think,know,declarative,declarative,1,1.02,victor,dinner,*MOT:	[laughs they'd like you to][laughs schedule it more than].,*MOT:	.. except it's on my calendar.,*MOT:	she understanded  .,*FAT: [grunts].,*MOT:	[laughs].,*FAT:	&mm: xxx.,*FAT: [grunts].,*MOT:	she said they call you the night .,*MOT:	they call you one night .. during the week before you come and,*CHI:	those things out.,*MOT:	I know I hate those things too artificial corn holders.,*FAT:	well .,*FAT: [grunts].,8138
I know you don't have_to .,richard_mothertoy.cha,2300,know,think,know,declarative,declarative,1,1.007,richard,mother,*MOT:	yeah.,*MOT:	what do you do with the spoon?,*MOT:	huh?,"*MOT:	Richard, I'm gonna take off the wheels.",*CHI:	no.,*MOT:	yes.,*MOT:	an you're gonna try and put them back on?,*MOT:	okay?,*CHI:	no.,*CHI:	don't have_to.,*MOT:	I know you don't have_to.,*CHI:	you don't have_to.,"*CHI:	you don't have_to, Mommy.",8138
"well , I know it's money .",bobby_mothertoy.cha,1282,know,think,know,declarative,declarative,1,1.017,bobby,mother,*MOT:	which one's the ten dollar bill?,*CHI:	this.,*MOT:	what's that number on it?,*CHI:	&uh xxx.,"*MOT:	no, what's the number?",*CHI:	&uh xxx.,*MOT:	look at it !,*MOT:	don't guess.,*MOT:	look at it.,*CHI:	money.,"*MOT:	well, I know it's money.",*MOT:	but what number's that?,*CHI:	xxx.,8138
I knew it kept spinning and it wasn't doing any good .,ursula_mothertoy.cha,3370,knew,thought,know,declarative,declarative,1,1.023,ursula,mother,*CHI:	that goes  in the back.,*MOT:	there's a thing that goes in the o@l.,*CHI:	&um .. this goes in the front because it  .,*MOT:	that's the wheel .,*MOT:	oh .,*CHI:	xxx .,*MOT:	that's why.,*MOT:	here.,*MOT:	this goes here.,*MOT:	that's why .,*MOT:	I knew it kept spinning and it wasn't doing any good.,*MOT:	there ya go.,*MOT:	this goes in here like this.,8138
I know you have Rice Krispies here in the store someplace .,david_mothertoy.cha,315,know,think,know,declarative,declarative,1,1.005,david,mother,*MOT:	you're trying to make me buy everything.,*CHI:	no.,*CHI:	no.,*CHI:	because that's what you have_to have.,*MOT:	okay.,*MOT:	Mr Storeman.,"*MOT:	there's one thing that I really, really, really want.",*MOT:	and I would really appreciate it if you would get it for me.,*CHI:	what is that?,*MOT:	and that's some Rice Krispies.,*MOT:	I know you have Rice Krispies here in the store someplace.,*MOT:	can you find me some?,*CHI:	I don't have any.,8138
I know you don't .,helen_dinner.cha,526,know,think,know,declarative,declarative,1,1.006,helen,dinner,*MOT:	when is the corn gonna be ready?,*CHI:	yeah.,"*MOT:	oh, in about ten minutes.","*CHI:	Mommy, I want some more soup.",*MOT:	you do?,"*MOT:	alright here, I'll give you some of mine, okay?","*SIS:	Ma, I don't want any more .","*FAT:	you can have some more carrots,   too.",*MOT:	oh.,*SIS:	I don't want any more.,*MOT:	I know you don't.,*MOT:	it's alright 6..,"*CHI:	thank_you, Daddy.",8138
and I know you like little books .,victor_mothertoy.cha,1812,know,think,know,declarative,declarative,1,1.004,victor,mother,*MOT:	may I see?,*CHI:	don't take a peek.,*MOT:	[laughs take a peek]?,*CHI:	no.,*MOT:	don't take a peek.,*MOT:	would you like a story?,"*CHI:	what, Mama?",*MOT:	would you like a story?,*CHI:	yeah.,*MOT:	I saw a little tiny book over here.,*MOT:	and I know you like little books.,*CHI:	where?,*MOT:	over here.,8138
oh I know you can why don't you just .,andy_mothertoy.cha,1315,know,think,know,declarative,declarative,1,1.009,andy,mother,*CHI:	where was it?,"*MOT:	oh, it's right there Andy.",*INV:	how's it going?,*MOT:	fine.,*INV:	don't feel that you have_to put it back together again.,*MOT:	oh.,*INV:	why don't you just move on to the next one?,*MOT:	oh okay.,*INV:	it's terribly complicated.,*CHI:	I can fix it up.,*INV:	oh I know you can why don't you just.,*MOT:	yeah yeah Andy's been talking about it cause he couldn't do it last,*INV:	well it is  it is  it's  it isn't important to put it,8138
"I know one of the wheels goes in here , right ?",andy_fathertoy.cha,1072,know,think,know,declarative,declarative,1,1.014,andy,father,*FAT:	yeah. ,*FAT:	you're right. ,*FAT:	does this red fellow go here? ,*FAT:	no. ,*FAT:	xxx. ,*CHI:	where is my place? ,*FAT:	xxx. ,*CHI:	where's my place? ,*FAT:	well I know one thing. ,*CHI:	what? ,"*FAT:	I know one of the wheels goes in here, right? ",*FAT:	xxx. ,*CHI:	that's not the wheel. ,8138
"oh , I know what that is .",patricia_fathertoy.cha,1767,know,think,know,declarative,interrogative,1,3.011,patricia,father,*CHI:	that's a boy.,"*FAT:	alright, let's see xxx your stereotypes.",*FAT:	is this a boy or a girl.,*CHI:	a boy.,*FAT:	that's a boy too.,"*FAT:	oh, there's hope for you.","*FAT:	alright, now .",*FAT:	oh we took something off.,*FAT:	what's this?,*CHI:	what's this?,"*FAT:	oh, I know what that is.",*CHI:	what?,*FAT:	it's called a jack.,8138
yeah I know what he wants .,olivia_dinner.cha,567,know,think,know,declarative,interrogative,1,3.014,olivia,dinner,*FAT:	they're unreal.,*MOT:	was he xxx that night?,*FAT:	he was on that night yeah.,*FAT:	he's a good public relations man.,*FAT:	he sent residents to the party while he stayed in the hospital,*CHI:	wah  !,*CHI:	wah  !,*FAT:	all public relations.,*MOT:	oolee:   what's the matter ?,*CHI:	wah wah [high pitched noises].,*MOT:	yeah I know what he wants.,*MOT:	. you tired little fella?,*FAT:	are you tired little fella ?,8138
oh I know what we can do for lunch .,charlie_fathertoy.cha,676,know,think,know,declarative,interrogative,1,3.009,charlie,father,*FAT:	chocolate. ,*CHI:	Oreos. ,*FAT:	Oreos. ,*FAT:	oh I see something that I would love to have for lunch. ,*FAT:	not that. ,*FAT:	lasagne. ,*CHI:	&mm lasagne . ,*FAT:	you know what  lasagne is? ,*CHI:	yeah. ,*CHI:	hey where that box is? ,*FAT:	oh I know what we can do for lunch. ,*CHI:	what? ,*FAT:	let's . ,8138
so I know where that store is now .,susan_dinner.cha,1388,know,think,know,declarative,interrogative,1,3.005,susan,dinner,*MOT:	it's a size six.,*CHI:	it's a size six.,*FAT:	[laughs].,*CHI:	[laughs but xxx].,*FAT:	for  a six year old?,*FAT:	no kidding !,*CHI:	[laughs].,*FAT:	now that's twice as big and old as you.,*FAT:	I finally found out where Jack's is.,*FAT:	I drove past it on my way way to Jane Cook's.,*FAT:	so I know where that store is now.,*MOT:	hm?,*MOT:	does she live in Briggffona?,8138
I know why I'm <standing up> [>] .,patricia_dinner.cha,2007,know,think,know,declarative,interrogative,1,3.003,patricia,dinner,*FAT:	I know.,"*FAT:	I showed her that, but xxx.",*FAT:	look at it after dinner if you want.,*FAT:	eat your pickle.,*FAT:	I gave you a pickle to eat.,*FAT:	Usher likes pickles.,*CHI:	mumnum  mummum  .,*MOT:	what.,*MOT:	is the  is the xxx gone?,*FAT:	alright.,*FAT:	I know why I'm standing up .,*FAT:	I wanna call Michael.,*MOT:	the french frys are all_gone.,8138
I know what it is .,martin_dinner.cha,2690,know,think,know,declarative,interrogative,1,3.012,martin,dinner,*CHI:	0.,*MOT:	whyn't  you eat those potatoes?,*MOT:	you did a very nice job.,*MOT:	you ate all your scallops and your salad.,*MOT:	whyn't  you eat some potato?,*FAT:	what's the red stuff on the floor here ?,*CHI:	Daddy ate the scallops .,*MOT:	yeah [laughs but Daddy didn't eat too many of em].,"*FAT:	oh, God !",*FAT:	there's chopped up +/.,*MOT:	I know what it is.,*FAT:	chopped up crayon.,*CHI:	I eat too many of em .,8138
I know what happens .,guy_mothertoy.cha,2323,know,think,know,declarative,interrogative,1,3.0154,guy,mother,*MOT:	 you didn't lose your kitty.,*CHI:	sit.,*MOT:	sit kitty?,*CHI:	uhhuh.,*MOT:	&mm.,*MOT:	why?,*MOT:	is the kitty running too fast or something?,*CHI:	uhhuh.,*MOT:	&mm.,*MOT:	oh.,*MOT:	I know what happens.,*MOT:	the policeman says to the cat .,*MOT:	 come here cat.,8138
"you know where to [//] where things go , right ?",andy_mothertoy.cha,1045,know,think,know,declarative,interrogative,2,3.001,andy,mother,*MOT:	okay. ,*CHI:	xxx back. ,*CHI:	I'll watch you. ,*MOT:	you'll watch me? ,*MOT:	you're not gonna help me? ,*MOT:	I'm not sure I could do it either. ,*CHI:	someone help us. ,"*MOT:	[laughs the blue screws go in front, right]? ",*MOT:	&th these are the headlights. ,*MOT:	you come help me. ,"*MOT:	you know where to  where things go, right? ",*MOT:	the people? ,*CHI:	the people belong inside it. ,8138
we know where the people go .,andy_fathertoy.cha,1418,know,think,know,declarative,interrogative,1,3.017,andy,father,*FAT:	where do the red and the black screw go? ,*CHI:	and where does dis  go? ,*CHI:	and these two blue screws? ,*FAT:	I dunno . ,*FAT:	and what was holding the wheel? ,*FAT:	we didn't remember. ,*FAT:	we should have .. maybe even written some things down. ,"*FAT:	like what belongs where, &hmm? ",*CHI:	but we knew where dese  people go . ,*FAT:	yup  that we know. ,*FAT:	we know where the people go. ,*CHI:	I know where dese:  go. ,*FAT:	I wonder what holds in the spare tire? ,8138
"oh I know what you're gonna buy , too .",eddie_mothertoy.cha,1803,know,think,know,declarative,interrogative,1,3.007,eddie,mother,*CHI:	I don't want to.,*MOT:	okay do you wanna buy something from me?,*CHI:	no.,*MOT:	huh?,*CHI:	what?,*MOT:	would you like to buy something from me?,"*MOT:	I'll be a store lady, okay?",*CHI:	nah.,*MOT:	and  you come over and buy something.,*CHI:	no I wanna be .,"*MOT:	oh I know what you're gonna buy, too.",*CHI:	no I wanna be .,*MOT:	you wanna be the storeman?,8138
<I know what> [<] that is .,ursula_fathertoy.cha,3671,know,think,know,declarative,interrogative,1,3.01,ursula,father,*INV:	I brought you a present for today's visit.,"*CHI:	look, Daddy.","*FAT:	what's that, Urs?",*CHI:	I don't know.,*CHI:	I can't open it.,*CHI:	it's too tight to xxx.,*INV:	it is pretty tight.,*INV:	that's just for today's visit.,*FAT: [gasp].,*INV:	we have another present for her second visit .,*FAT:	I know what  that is.,*CHI:	what is it?,*FAT:	that's bubbles.,8138
&uh o:h now I know why they call it a Take_apart car [=! laughs] !,wanda_mothertoy.cha,481,know,think,know,declarative,interrogative,1,3.002,wanda,mother,*MOT:	you want to make it looser if you want to take it apart.,*CHI:	oh [coughs].,*CHI:	I wonder if the door's locked.,"*MOT:	oh, no.",*MOT:	it's not locked.,*MOT:	it's just closed so_that people walking up and down the hall won't,*CHI:	oh.,*MOT:	that's one more.,"*MOT:	okay ., who's going to take the tire off, me or you?",*MOT:	you.,*MOT:	&uh oh now I know why they call it a Take_apart car [laughs]!,*MOT:	that's one whole side of the car taken apart.,"*MOT:	here, we've got one more side of the car to take apart.",8138
"I know what goes back here , Lisa .",wanda_mothertoy.cha,1000,know,think,know,declarative,interrogative,1,3.016,wanda,mother,*CHI:	Lisa.,"*MOT:	Debbie and Lisa, the two mechanics?",*CHI:	yeah.,"*MOT:	okay, Debbie   Debbie what do think we.",*CHI:	Debra .,*MOT:	should do?,*CHI:	&uh.,*MOT:	to fix this car?,*CHI:	I don't know.,"*MOT:	&um, let's see if I can remember what goes back here.","*MOT:	I know what goes back here, Lisa.",*MOT:	Debbie.,*MOT:	who are you?,8138
I know what we could do .,david_dinner.cha,1401,know,think,know,declarative,interrogative,1,3.008,david,dinner,*FAT:	I'm afraid we are  I think with your cream cheese and . &uh,"*FAT:	what're we gonna do when we wanna have a garlic bagel, David, or",*CHI:	we can &um.,*CHI:	you know what you can do?,*MOT:	what?,*SIS:	cream cheese and bagel on a . on a . &c  on a pretzel.,*MOT:	on a pretzel.,"*MOT:	oh, dear.","*MOT:	it's just not the same, though.",*CHI:	is that xxx.,*MOT:	I know what we could do., ,*CHI:	yeah !,8138
I know where they go .,frank_fathertoy.cha,659,know,think,know,declarative,interrogative,1,3.004,frank,father,*CHI:	this go in here?,*FAT:	I don't think so.,*FAT:	xxx something else goes in there first.,*FAT:	wait a minute.,*CHI:	what?,*FAT:	doesn't something go in there?,*FAT:	what about these.,*FAT:	where do they go?,*FAT:	&uh oh.,*FAT:	oh.,*FAT:	I know where they go.,*FAT:	you know where they go?,*FAT:	where?,8138
do you know when we parked the car just now I haved to put a quarter in the parking+meter ?,nanette_mothertoy.cha,814,know,think,know,interrogative,declarative,2,4.003,nanette,mother,*MOT:	what's that?,*CHI:	a quarter.,*MOT:	a quarter.,*MOT:	right.,*MOT:	do you remember what this one is?,"*MOT:	wait, this is a quarter you press this for a quarter it's a two",*MOT:	do you know what this one is?,*CHI:	a penny.,"*MOT:	&mm, here's a penny.",*MOT:	there's lots_of money here and we can buy lots_of food with the,*MOT:	do you know when we parked the car just now I haved to put a quarter in the parkingmeter?,*MOT:	cause it costs money to park your car on the street.,*CHI:	that's a bunny rabbit.,8138
did you know cars come apart like this ?,laurel_mothertoy.cha,336,know,think,know,interrogative,declarative,2,4.02,laurel,mother,*MOT:	I haved to put your light switch back on.,*CHI:	xxx.,*MOT:	did you have a flat tire?,*MOT:	you're gonna put a new tire on?,*CHI:	mhm.,*MOT:	does this tire need to be taken off too?,*MOT:	do you know how to do that?,*CHI:	xxx.,*MOT:	do you like this car?,*CHI:	yeah.,*MOT:	did you know cars come apart like this?,*CHI:	xxx.,*CHI:	this xxx.,8138
did you know there was water on the other side ?,laurel_fathertoy.cha,628,know,think,know,interrogative,declarative,2,4.018,laurel,father,*FAT:	are they gonna get wet?,*CHI:	yeah.,*FAT:	do you think they'd better put their &sw .,*FAT:	look [gasp].,*FAT:	you're right.,*FAT:	look.,*FAT:	it's a hole that's gonna go into the water.,*FAT:	did you read this book before?,*FAT:	have you seen this book before?,*CHI:	no.,*FAT:	did you know there was water on the other side?,*FAT:	look.,*CHI:	hey .,8138
did his mother know he was here ?,frank_dinner.cha,341,know,think,know,interrogative,declarative,3,4.002,frank,dinner,*FAT:	you know why  you didn't go to the pool?,*CHI:	why?,*FAT:	it was raining.,*CHI:	oh.,*CHI:	I already picked my salad.,*MOT:	oh.,*MOT:	you did pick your salad?,*MOT:	that's healthy.,*MOT:	now tell Daddy about how you played with Michael today.,*MOT:	on the way home from school we met him playing alone and so he came,*FAT:	did his mother know he was here?,*MOT:	well he called her.,*FAT:	he knows his phone number?,8138
you know that we're going to go ?,theresa_dinner.cha,1060,know,think,know,interrogative,declarative,2,4.006,theresa,dinner,*CHI:	and then we saw some tom  tomato juice on somebod  on,*MOT:	xxx  ya know what I think?,*FAT:	&hmm.,*CHI:	what?,*MOT: [laughing I think you're making up a big story].,*CHI:	I'm not !,*FAT:	you know that  in about a month we're going to Florida?,*CHI:	Daddy: !,*CHI:	are you there?,*CHI:	what'd you say about .,*FAT:	you know that we're going to go?,*CHI:	yes !,*FAT:	we gonna fly a plane.,8138
"xxx do you know that the steering+wheel comes off , Richard ?",richard_mothertoy.cha,558,know,think,know,interrogative,declarative,2,4.014,richard,mother,*MOT:	we're gonna hafta leave this part.,*MOT:	good.,*MOT:	I think maybe we'd better put the tire back in.,*CHI:	where's this go ?,*MOT:	you think maybe we'd better put the tire back in before we start,*CHI:	where's dis  go?,*CHI:	where's dis  go?,*CHI:	where's dis  go Mommy?,"*MOT:	Richard, let me see.",*MOT:	this goes right here.,"*MOT:	xxx do you know that the steeringwheel comes off, Richard?",*CHI:	yes.,*MOT:	you wanna see how the steeringwheel comes off?,8138
do you know that you can unscrew this right here ?,martin_mothertoy.cha,284,know,think,know,interrogative,declarative,2,4.011,martin,mother,*CHI:	xxx car xxx what's this?,*CHI:	xxx.,*MOT:	you wanna play with this car?,*MOT:	you want me to show you how it works?,*MOT:	do you know what  do you know what this is?,*MOT:	that's a screwdriver.,*CHI:	uhhuh I wanna use it.,*CHI:	xxx.,*MOT:	do you what takes a .,*MOT:	do you know that this car comes apart?,*MOT:	do you know that you can unscrew this right here?,*CHI:	yeah.,*MOT:	that's right yeah look at that.,8138
do you know that this car comes apart ?,martin_mothertoy.cha,280,know,think,know,interrogative,declarative,2,4.012,martin,mother,*MOT:	do you know what this is?,*CHI:	xxx car xxx what's this?,*CHI:	xxx.,*MOT:	you wanna play with this car?,*MOT:	you want me to show you how it works?,*MOT:	do you know what  do you know what this is?,*MOT:	that's a screwdriver.,*CHI:	uhhuh I wanna use it.,*CHI:	xxx.,*MOT:	do you what takes a .,*MOT:	do you know that this car comes apart?,*MOT:	do you know that you can unscrew this right here?,*CHI:	yeah.,8138
o:h did she know that was the cat in there ?,theresa_mothertoy.cha,196,know,think,know,interrogative,declarative,3,4.001,theresa,mother,*CHI:	yeah .,*MOT:	okay .,*MOT:	turn the page now?,*CHI:	yes.,*MOT:	okay.,*CHI:	and  and then  and then the &um +/.,*MOT:	xxx the picture first .,*CHI:	and then  the cat fell out when when she was &um picking the,*CHI:	and then  and then  then she no baby.,*CHI:	an the  an the  an the  an the  an the cloth fell out.,*MOT:	oh did she know that was the cat in there?,*MOT:	or xxx was the baby that she thought?,*CHI:	she thought that a cat was there.,8138
do you know they don't have bagels in Israel ?,david_dinner.cha,1271,know,think,know,interrogative,declarative,2,4.01,david,dinner,*CHI:	I don't like these . anyway.,*FAT:	 would you eat them in a box?,*FAT:	 would you eat them with a .,*CHI:	xxx.,*FAT:	 not in a box.,*CHI:	not in a box.,*FAT:	 not with a fox .,*FAT:	 not in a house .,*CHI:	not in a box.,*MOT:	how bout with some lox?,*MOT:	do you know they don't have bagels in Israel?,*FAT:	no +/.,*MOT:	couldn't believe it.,8138
you know that Betty's going to bring that dog to Israel ?,david_dinner.cha,561,know,think,know,interrogative,declarative,2,4.008,david,dinner,*MOT:	and .. a big cat.,*CHI:	a what +/.,*MOT:	and they were fighting with each_other.,"*CHI:	&uh, how did Betty stopped it?",*MOT:	she said .,*MOT:	 stop it you guys !,*CHI:	and did they do it?,"*MOT:	yeah, they did.",*CHI:	what?,"*MOT:	yeah, they stopped.",*MOT:	you know that Betty's going to bring that dog to Israel?,*MOT:	I don't believe it.,*FAT:	hm.,8138
do you know that they go to school and they even have work to do in school ?,john_dinner.cha,220,know,think,know,interrogative,declarative,2,4.013,john,dinner,*FAT:	xxx.,*MOT:	anybody that's hungry.,*MOT:	come over here.,*FAT:	we're having supper.,*CHI:	xxx.,*FAT:	we're having supper right now.,*MOT:	as a matter of fact we're going to close the door here.,"*MOT:	no, no one is playing here.","*MOT:	no, I want to explain something to you.",*MOT:	Janet and Sandy are not playing now.,*MOT:	do you know that they go to school and they even have work to do in school?,*FAT:	and do you know something else?,*MOT:	can you get out some glass and stuff so we can   .,8138
you [/] you know you slept until daddy hadda [: had to] wake you up ?,laurel_dinner.cha,2180,know,think,know,interrogative,declarative,2,4.004,laurel,dinner,*FAT:	hang on.,"*FAT:	the other thing, tootsie .",*MOT:	yeah.,*CHI:	wanna get down now.,*CHI:	wanna get down.,"*MOT:	you know, you're gonna wake up at about ten o'clock and tell me",*FAT:	what time did you sleep till this morning?,*MOT:	she slept a long time.,*FAT:	she slept until I woke her up to &ge  to go to work .,"*MOT:	yeah, she slept a long time .",*FAT:	you  you know you slept until daddy hadda  wake you up?,*FAT:	do you know daddy woke you up this morning ?,*MOT:	you was a very good girl this morning .,8138
you know this surcharge thing that everybody got back ?,frank_dinner.cha,1040,know,think,know,interrogative,declarative,2,4.016,frank,dinner,*CHI:	I want it.,*MOT:	yeah.,*MOT:	I'll cut it.,*MOT:	I'll cut it.,*CHI:	xxx can have it.,*MOT:	ow.,*MOT:	ow.,*MOT:	ow ow ow.,*CHI:	where's the potatos ?,*MOT:	something about  .,*MOT:	you know this surcharge thing that everybody got back?,"*MOT:	well, he counted that as  as how much  as part of our",*FAT:	yeah.,8138
did you know this is a tunnel ?,nanette_mothertoy.cha,1553,know,think,know,interrogative,declarative,2,4.017,nanette,mother,*MOT:	do you know what that means?,*MOT:	when Mommy does that to you what does it mean?,*CHI: [giggles].,*MOT:	it means .,*MOT:	 come here.,"*CHI:	 come here, kitty.","*MOT:	yeah, .",*MOT:	 come here kitty.,"*MOT:	oh, you know it isn't a mirror !",*MOT:	I don't know .,*MOT:	did you know this is a tunnel?,*MOT:	you see?,"*MOT:	there's a big hole, and it goes through here, and it comes out",8138
you know how many there are ?,wanda_mothertoy.cha,624,know,think,know,interrogative,interrogative,2,6.176,wanda,mother,"*CHI:	okay, xxx what .",*MOT:	&hmm?,*MOT:	something in the trunk too.,"*MOT:	oh, look what the trunk has in it.",*MOT:	a spare tire.,*MOT:	that's like in our car we have a spare tire in_case we get a flat,*MOT:	so_that  has_to be taken apart too.,*CHI:	xxx .,*CHI:	we have the last tire here.,*MOT:	mhm.,*MOT:	you know how many there are?,*MOT:	or do you have_to count them?,"*CHI:	one, two, three, four, five.",8138
do you know how that works ?,charlie_mothertoy.cha,3234,know,think,know,interrogative,interrogative,2,6.296,charlie,mother,*INV:	I'm associated with the project.,*MOT:	uhhuh.,*INV:	hi Charlie !,*CHI:	hi.,*MOT:	can you say .,*MOT:	 hi.,*CHI:	hi.,*INV:	I have a little gift for you for today's visit.,*CHI:	wow: !,*MOT:	oh Charlie !,*INV:	do you know how that works?,*MOT:	will it go?,*MOT:	you do know how it goes but its stuck.,8138
do you know why you had a good day ?,eddie_dinner.cha,1670,know,think,know,interrogative,interrogative,2,6.181,eddie,dinner,*CHI:	yes.,*FAT:	okay.,"*FAT:	. it's getting near your bedtime, right?",*FAT:	hm?,*CHI:	right.,*FAT:	right !,*CHI:	I want to listen to the tape recorder.,*FAT:	xxx.,*MOT:	did you think you had a good day today or a bad day?,*CHI:	good day.,*MOT:	do you know why you had a good day?,*MOT:	can you give us a reason why it was a good day?,*FAT:	can I have a little of this?,8138
oh you know what I see back there ?,helen_fathertoy.cha,1787,know,think,know,interrogative,interrogative,2,6.03,helen,father,*CHI:	I can't: xxx.,*FAT:	yes you can.,*CHI:	no it's too high.,*CHI:	look.,*FAT:	oh xxx.,*CHI:	it's fifty nine cents cause I did it.,*CHI:	I pressed .,*CHI:	I did it fifty nine cents.,*FAT:	okay what else should we get?,*CHI:	&uh buy some cookies.,*FAT:	oh you know what I see back there?,*CHI:	what?,*CHI:	&uh spaghet  spa .,8138
